{
  "address": "0xef9dD99ae11E8af19a6625AF05DB57A93972eD89",
  "abi": [
    {
      "inputs": [],
      "stateMutability": "nonpayable",
      "type": "constructor"
    },
    {
      "anonymous": false,
      "inputs": [
        {
          "indexed": true,
          "internalType": "address",
          "name": "owner",
          "type": "address"
        },
        {
          "indexed": true,
          "internalType": "address",
          "name": "spender",
          "type": "address"
        },
        {
          "indexed": false,
          "internalType": "uint256",
          "name": "amount",
          "type": "uint256"
        }
      ],
      "name": "Approval",
      "type": "event"
    },
    {
      "anonymous": false,
      "inputs": [
        {
          "indexed": true,
          "internalType": "address",
          "name": "delegator",
          "type": "address"
        },
        {
          "indexed": true,
          "internalType": "address",
          "name": "fromDelegate",
          "type": "address"
        },
        {
          "indexed": true,
          "internalType": "address",
          "name": "toDelegate",
          "type": "address"
        }
      ],
      "name": "DelegateChanged",
      "type": "event"
    },
    {
      "anonymous": false,
      "inputs": [
        {
          "indexed": true,
          "internalType": "address",
          "name": "delegate",
          "type": "address"
        },
        {
          "indexed": false,
          "internalType": "uint256",
          "name": "previousBalance",
          "type": "uint256"
        },
        {
          "indexed": false,
          "internalType": "uint256",
          "name": "newBalance",
          "type": "uint256"
        }
      ],
      "name": "DelegateVotesChanged",
      "type": "event"
    },
    {
      "anonymous": false,
      "inputs": [
        {
          "indexed": true,
          "internalType": "address",
          "name": "from",
          "type": "address"
        },
        {
          "indexed": true,
          "internalType": "address",
          "name": "to",
          "type": "address"
        },
        {
          "indexed": false,
          "internalType": "uint256",
          "name": "amount",
          "type": "uint256"
        }
      ],
      "name": "Transfer",
      "type": "event"
    },
    {
      "inputs": [],
      "name": "DELEGATION_TYPEHASH",
      "outputs": [
        {
          "internalType": "bytes32",
          "name": "",
          "type": "bytes32"
        }
      ],
      "stateMutability": "view",
      "type": "function"
    },
    {
      "inputs": [],
      "name": "DOMAIN_TYPEHASH",
      "outputs": [
        {
          "internalType": "bytes32",
          "name": "",
          "type": "bytes32"
        }
      ],
      "stateMutability": "view",
      "type": "function"
    },
    {
      "inputs": [
        {
          "internalType": "address",
          "name": "account",
          "type": "address"
        },
        {
          "internalType": "address",
          "name": "spender",
          "type": "address"
        }
      ],
      "name": "allowance",
      "outputs": [
        {
          "internalType": "uint256",
          "name": "",
          "type": "uint256"
        }
      ],
      "stateMutability": "view",
      "type": "function"
    },
    {
      "inputs": [
        {
          "internalType": "address",
          "name": "spender",
          "type": "address"
        },
        {
          "internalType": "uint256",
          "name": "rawAmount",
          "type": "uint256"
        }
      ],
      "name": "approve",
      "outputs": [
        {
          "internalType": "bool",
          "name": "",
          "type": "bool"
        }
      ],
      "stateMutability": "nonpayable",
      "type": "function"
    },
    {
      "inputs": [
        {
          "internalType": "address",
          "name": "account",
          "type": "address"
        }
      ],
      "name": "balanceOf",
      "outputs": [
        {
          "internalType": "uint256",
          "name": "",
          "type": "uint256"
        }
      ],
      "stateMutability": "view",
      "type": "function"
    },
    {
      "inputs": [
        {
          "internalType": "address",
          "name": "",
          "type": "address"
        },
        {
          "internalType": "uint32",
          "name": "",
          "type": "uint32"
        }
      ],
      "name": "checkpoints",
      "outputs": [
        {
          "internalType": "uint32",
          "name": "fromBlock",
          "type": "uint32"
        },
        {
          "internalType": "uint96",
          "name": "votes",
          "type": "uint96"
        }
      ],
      "stateMutability": "view",
      "type": "function"
    },
    {
      "inputs": [],
      "name": "decimals",
      "outputs": [
        {
          "internalType": "uint8",
          "name": "",
          "type": "uint8"
        }
      ],
      "stateMutability": "view",
      "type": "function"
    },
    {
      "inputs": [
        {
          "internalType": "address",
          "name": "delegatee",
          "type": "address"
        }
      ],
      "name": "delegate",
      "outputs": [],
      "stateMutability": "nonpayable",
      "type": "function"
    },
    {
      "inputs": [
        {
          "internalType": "address",
          "name": "delegatee",
          "type": "address"
        },
        {
          "internalType": "uint256",
          "name": "nonce",
          "type": "uint256"
        },
        {
          "internalType": "uint256",
          "name": "expiry",
          "type": "uint256"
        },
        {
          "internalType": "uint8",
          "name": "v",
          "type": "uint8"
        },
        {
          "internalType": "bytes32",
          "name": "r",
          "type": "bytes32"
        },
        {
          "internalType": "bytes32",
          "name": "s",
          "type": "bytes32"
        }
      ],
      "name": "delegateBySig",
      "outputs": [],
      "stateMutability": "nonpayable",
      "type": "function"
    },
    {
      "inputs": [
        {
          "internalType": "address",
          "name": "",
          "type": "address"
        }
      ],
      "name": "delegates",
      "outputs": [
        {
          "internalType": "address",
          "name": "",
          "type": "address"
        }
      ],
      "stateMutability": "view",
      "type": "function"
    },
    {
      "inputs": [
        {
          "internalType": "address",
          "name": "account",
          "type": "address"
        }
      ],
      "name": "getCurrentVotes",
      "outputs": [
        {
          "internalType": "uint96",
          "name": "",
          "type": "uint96"
        }
      ],
      "stateMutability": "view",
      "type": "function"
    },
    {
      "inputs": [
        {
          "internalType": "address",
          "name": "account",
          "type": "address"
        },
        {
          "internalType": "uint256",
          "name": "blockNumber",
          "type": "uint256"
        }
      ],
      "name": "getPriorVotes",
      "outputs": [
        {
          "internalType": "uint96",
          "name": "",
          "type": "uint96"
        }
      ],
      "stateMutability": "view",
      "type": "function"
    },
    {
      "inputs": [],
      "name": "name",
      "outputs": [
        {
          "internalType": "string",
          "name": "",
          "type": "string"
        }
      ],
      "stateMutability": "view",
      "type": "function"
    },
    {
      "inputs": [
        {
          "internalType": "address",
          "name": "",
          "type": "address"
        }
      ],
      "name": "nonces",
      "outputs": [
        {
          "internalType": "uint256",
          "name": "",
          "type": "uint256"
        }
      ],
      "stateMutability": "view",
      "type": "function"
    },
    {
      "inputs": [
        {
          "internalType": "address",
          "name": "",
          "type": "address"
        }
      ],
      "name": "numCheckpoints",
      "outputs": [
        {
          "internalType": "uint32",
          "name": "",
          "type": "uint32"
        }
      ],
      "stateMutability": "view",
      "type": "function"
    },
    {
      "inputs": [],
      "name": "symbol",
      "outputs": [
        {
          "internalType": "string",
          "name": "",
          "type": "string"
        }
      ],
      "stateMutability": "view",
      "type": "function"
    },
    {
      "inputs": [],
      "name": "totalSupply",
      "outputs": [
        {
          "internalType": "uint256",
          "name": "",
          "type": "uint256"
        }
      ],
      "stateMutability": "view",
      "type": "function"
    },
    {
      "inputs": [
        {
          "internalType": "address",
          "name": "dst",
          "type": "address"
        },
        {
          "internalType": "uint256",
          "name": "rawAmount",
          "type": "uint256"
        }
      ],
      "name": "transfer",
      "outputs": [
        {
          "internalType": "bool",
          "name": "",
          "type": "bool"
        }
      ],
      "stateMutability": "nonpayable",
      "type": "function"
    },
    {
      "inputs": [
        {
          "internalType": "address",
          "name": "src",
          "type": "address"
        },
        {
          "internalType": "address",
          "name": "dst",
          "type": "address"
        },
        {
          "internalType": "uint256",
          "name": "rawAmount",
          "type": "uint256"
        }
      ],
      "name": "transferFrom",
      "outputs": [
        {
          "internalType": "bool",
          "name": "",
          "type": "bool"
        }
      ],
      "stateMutability": "nonpayable",
      "type": "function"
    }
  ],
  "transactionHash": "0xc2b0a8b1809b5f82fe3bc65a3418bec5757b869943acb5051789b44aad6bc84a",
  "receipt": {
    "to": null,
    "from": "0xdfD17f7aBc384Eeb611FAc7f17416E6eF00bdd56",
    "contractAddress": "0xef9dD99ae11E8af19a6625AF05DB57A93972eD89",
    "transactionIndex": 469,
    "gasUsed": "1392423",
    "logsBloom": "0x00000000000000000000000000000000000000000000000000000000000000000000000000000000000000020000000000000000000000000000000000000000000000000000000000000008000000000000000000000000000000000000000000000000020000000020002000040800000000000000000000000010000000000000000000000000000000000000000000000000000000000000000000000000000000000000000000000000000000000000000040000000000000000000000000000002000000000000000000000000000000000000000000000000000020000000000000000000000000000000000000000000000000000000000000000000",
    "blockHash": "0x02068e878354286f9c5cffc45763cb06321410eae25e26a24ee8fda0c2e0dfab",
    "transactionHash": "0xc2b0a8b1809b5f82fe3bc65a3418bec5757b869943acb5051789b44aad6bc84a",
    "logs": [
      {
        "transactionIndex": 469,
        "blockNumber": 7323258,
        "transactionHash": "0xc2b0a8b1809b5f82fe3bc65a3418bec5757b869943acb5051789b44aad6bc84a",
        "address": "0xef9dD99ae11E8af19a6625AF05DB57A93972eD89",
        "topics": [
          "0xddf252ad1be2c89b69c2b068fc378daa952ba7f163c4a11628f55a4df523b3ef",
          "0x0000000000000000000000000000000000000000000000000000000000000000",
          "0x000000000000000000000000dfd17f7abc384eeb611fac7f17416e6ef00bdd56"
        ],
        "data": "0x000000000000000000000000000000000000000000295be96e64066972000000",
        "logIndex": 1113,
        "blockHash": "0x02068e878354286f9c5cffc45763cb06321410eae25e26a24ee8fda0c2e0dfab"
      }
    ],
    "blockNumber": 7323258,
    "cumulativeGasUsed": "50297227",
    "status": 1,
    "byzantium": true
  },
  "args": [],
  "solcInputHash": "d2aeebd9d33a9f88c7ccd482d6ade490",
  "metadata": "{\"compiler\":{\"version\":\"0.6.12+commit.27d51765\"},\"language\":\"Solidity\",\"output\":{\"abi\":[{\"inputs\":[],\"stateMutability\":\"nonpayable\",\"type\":\"constructor\"},{\"anonymous\":false,\"inputs\":[{\"indexed\":true,\"internalType\":\"address\",\"name\":\"owner\",\"type\":\"address\"},{\"indexed\":true,\"internalType\":\"address\",\"name\":\"spender\",\"type\":\"address\"},{\"indexed\":false,\"internalType\":\"uint256\",\"name\":\"amount\",\"type\":\"uint256\"}],\"name\":\"Approval\",\"type\":\"event\"},{\"anonymous\":false,\"inputs\":[{\"indexed\":true,\"internalType\":\"address\",\"name\":\"delegator\",\"type\":\"address\"},{\"indexed\":true,\"internalType\":\"address\",\"name\":\"fromDelegate\",\"type\":\"address\"},{\"indexed\":true,\"internalType\":\"address\",\"name\":\"toDelegate\",\"type\":\"address\"}],\"name\":\"DelegateChanged\",\"type\":\"event\"},{\"anonymous\":false,\"inputs\":[{\"indexed\":true,\"internalType\":\"address\",\"name\":\"delegate\",\"type\":\"address\"},{\"indexed\":false,\"internalType\":\"uint256\",\"name\":\"previousBalance\",\"type\":\"uint256\"},{\"indexed\":false,\"internalType\":\"uint256\",\"name\":\"newBalance\",\"type\":\"uint256\"}],\"name\":\"DelegateVotesChanged\",\"type\":\"event\"},{\"anonymous\":false,\"inputs\":[{\"indexed\":true,\"internalType\":\"address\",\"name\":\"from\",\"type\":\"address\"},{\"indexed\":true,\"internalType\":\"address\",\"name\":\"to\",\"type\":\"address\"},{\"indexed\":false,\"internalType\":\"uint256\",\"name\":\"amount\",\"type\":\"uint256\"}],\"name\":\"Transfer\",\"type\":\"event\"},{\"inputs\":[],\"name\":\"DELEGATION_TYPEHASH\",\"outputs\":[{\"internalType\":\"bytes32\",\"name\":\"\",\"type\":\"bytes32\"}],\"stateMutability\":\"view\",\"type\":\"function\"},{\"inputs\":[],\"name\":\"DOMAIN_TYPEHASH\",\"outputs\":[{\"internalType\":\"bytes32\",\"name\":\"\",\"type\":\"bytes32\"}],\"stateMutability\":\"view\",\"type\":\"function\"},{\"inputs\":[{\"internalType\":\"address\",\"name\":\"account\",\"type\":\"address\"},{\"internalType\":\"address\",\"name\":\"spender\",\"type\":\"address\"}],\"name\":\"allowance\",\"outputs\":[{\"internalType\":\"uint256\",\"name\":\"\",\"type\":\"uint256\"}],\"stateMutability\":\"view\",\"type\":\"function\"},{\"inputs\":[{\"internalType\":\"address\",\"name\":\"spender\",\"type\":\"address\"},{\"internalType\":\"uint256\",\"name\":\"rawAmount\",\"type\":\"uint256\"}],\"name\":\"approve\",\"outputs\":[{\"internalType\":\"bool\",\"name\":\"\",\"type\":\"bool\"}],\"stateMutability\":\"nonpayable\",\"type\":\"function\"},{\"inputs\":[{\"internalType\":\"address\",\"name\":\"account\",\"type\":\"address\"}],\"name\":\"balanceOf\",\"outputs\":[{\"internalType\":\"uint256\",\"name\":\"\",\"type\":\"uint256\"}],\"stateMutability\":\"view\",\"type\":\"function\"},{\"inputs\":[{\"internalType\":\"address\",\"name\":\"\",\"type\":\"address\"},{\"internalType\":\"uint32\",\"name\":\"\",\"type\":\"uint32\"}],\"name\":\"checkpoints\",\"outputs\":[{\"internalType\":\"uint32\",\"name\":\"fromBlock\",\"type\":\"uint32\"},{\"internalType\":\"uint96\",\"name\":\"votes\",\"type\":\"uint96\"}],\"stateMutability\":\"view\",\"type\":\"function\"},{\"inputs\":[],\"name\":\"decimals\",\"outputs\":[{\"internalType\":\"uint8\",\"name\":\"\",\"type\":\"uint8\"}],\"stateMutability\":\"view\",\"type\":\"function\"},{\"inputs\":[{\"internalType\":\"address\",\"name\":\"delegatee\",\"type\":\"address\"}],\"name\":\"delegate\",\"outputs\":[],\"stateMutability\":\"nonpayable\",\"type\":\"function\"},{\"inputs\":[{\"internalType\":\"address\",\"name\":\"delegatee\",\"type\":\"address\"},{\"internalType\":\"uint256\",\"name\":\"nonce\",\"type\":\"uint256\"},{\"internalType\":\"uint256\",\"name\":\"expiry\",\"type\":\"uint256\"},{\"internalType\":\"uint8\",\"name\":\"v\",\"type\":\"uint8\"},{\"internalType\":\"bytes32\",\"name\":\"r\",\"type\":\"bytes32\"},{\"internalType\":\"bytes32\",\"name\":\"s\",\"type\":\"bytes32\"}],\"name\":\"delegateBySig\",\"outputs\":[],\"stateMutability\":\"nonpayable\",\"type\":\"function\"},{\"inputs\":[{\"internalType\":\"address\",\"name\":\"\",\"type\":\"address\"}],\"name\":\"delegates\",\"outputs\":[{\"internalType\":\"address\",\"name\":\"\",\"type\":\"address\"}],\"stateMutability\":\"view\",\"type\":\"function\"},{\"inputs\":[{\"internalType\":\"address\",\"name\":\"account\",\"type\":\"address\"}],\"name\":\"getCurrentVotes\",\"outputs\":[{\"internalType\":\"uint96\",\"name\":\"\",\"type\":\"uint96\"}],\"stateMutability\":\"view\",\"type\":\"function\"},{\"inputs\":[{\"internalType\":\"address\",\"name\":\"account\",\"type\":\"address\"},{\"internalType\":\"uint256\",\"name\":\"blockNumber\",\"type\":\"uint256\"}],\"name\":\"getPriorVotes\",\"outputs\":[{\"internalType\":\"uint96\",\"name\":\"\",\"type\":\"uint96\"}],\"stateMutability\":\"view\",\"type\":\"function\"},{\"inputs\":[],\"name\":\"name\",\"outputs\":[{\"internalType\":\"string\",\"name\":\"\",\"type\":\"string\"}],\"stateMutability\":\"view\",\"type\":\"function\"},{\"inputs\":[{\"internalType\":\"address\",\"name\":\"\",\"type\":\"address\"}],\"name\":\"nonces\",\"outputs\":[{\"internalType\":\"uint256\",\"name\":\"\",\"type\":\"uint256\"}],\"stateMutability\":\"view\",\"type\":\"function\"},{\"inputs\":[{\"internalType\":\"address\",\"name\":\"\",\"type\":\"address\"}],\"name\":\"numCheckpoints\",\"outputs\":[{\"internalType\":\"uint32\",\"name\":\"\",\"type\":\"uint32\"}],\"stateMutability\":\"view\",\"type\":\"function\"},{\"inputs\":[],\"name\":\"symbol\",\"outputs\":[{\"internalType\":\"string\",\"name\":\"\",\"type\":\"string\"}],\"stateMutability\":\"view\",\"type\":\"function\"},{\"inputs\":[],\"name\":\"totalSupply\",\"outputs\":[{\"internalType\":\"uint256\",\"name\":\"\",\"type\":\"uint256\"}],\"stateMutability\":\"view\",\"type\":\"function\"},{\"inputs\":[{\"internalType\":\"address\",\"name\":\"dst\",\"type\":\"address\"},{\"internalType\":\"uint256\",\"name\":\"rawAmount\",\"type\":\"uint256\"}],\"name\":\"transfer\",\"outputs\":[{\"internalType\":\"bool\",\"name\":\"\",\"type\":\"bool\"}],\"stateMutability\":\"nonpayable\",\"type\":\"function\"},{\"inputs\":[{\"internalType\":\"address\",\"name\":\"src\",\"type\":\"address\"},{\"internalType\":\"address\",\"name\":\"dst\",\"type\":\"address\"},{\"internalType\":\"uint256\",\"name\":\"rawAmount\",\"type\":\"uint256\"}],\"name\":\"transferFrom\",\"outputs\":[{\"internalType\":\"bool\",\"name\":\"\",\"type\":\"bool\"}],\"stateMutability\":\"nonpayable\",\"type\":\"function\"}],\"devdoc\":{\"kind\":\"dev\",\"methods\":{\"allowance(address,address)\":{\"params\":{\"account\":\"The address of the account holding the funds\",\"spender\":\"The address of the account spending the funds\"},\"returns\":{\"_0\":\"The number of tokens approved\"}},\"approve(address,uint256)\":{\"details\":\"This will overwrite the approval amount for `spender`  and is subject to issues noted [here](https://eips.ethereum.org/EIPS/eip-20#approve)\",\"params\":{\"rawAmount\":\"The number of tokens that are approved (2^256-1 means infinite)\",\"spender\":\"The address of the account which may transfer tokens\"},\"returns\":{\"_0\":\"Whether or not the approval succeeded\"}},\"balanceOf(address)\":{\"params\":{\"account\":\"The address of the account to get the balance of\"},\"returns\":{\"_0\":\"The number of tokens held\"}},\"delegate(address)\":{\"params\":{\"delegatee\":\"The address to delegate votes to\"}},\"delegateBySig(address,uint256,uint256,uint8,bytes32,bytes32)\":{\"params\":{\"delegatee\":\"The address to delegate votes to\",\"expiry\":\"The time at which to expire the signature\",\"nonce\":\"The contract state required to match the signature\",\"r\":\"Half of the ECDSA signature pair\",\"s\":\"Half of the ECDSA signature pair\",\"v\":\"The recovery byte of the signature\"}},\"getCurrentVotes(address)\":{\"params\":{\"account\":\"The address to get votes balance\"},\"returns\":{\"_0\":\"The number of current votes for `account`\"}},\"getPriorVotes(address,uint256)\":{\"details\":\"Block number must be a finalized block or else this function will revert to prevent misinformation.\",\"params\":{\"account\":\"The address of the account to check\",\"blockNumber\":\"The block number to get the vote balance at\"},\"returns\":{\"_0\":\"The number of votes the account had as of the given block\"}},\"transfer(address,uint256)\":{\"params\":{\"dst\":\"The address of the destination account\",\"rawAmount\":\"The number of tokens to transfer\"},\"returns\":{\"_0\":\"Whether or not the transfer succeeded\"}},\"transferFrom(address,address,uint256)\":{\"params\":{\"dst\":\"The address of the destination account\",\"rawAmount\":\"The number of tokens to transfer\",\"src\":\"The address of the source account\"},\"returns\":{\"_0\":\"Whether or not the transfer succeeded\"}}},\"version\":1},\"userdoc\":{\"events\":{\"Approval(address,address,uint256)\":{\"notice\":\"The standard EIP-20 approval event\"},\"DelegateChanged(address,address,address)\":{\"notice\":\"An event thats emitted when an account changes its delegate\"},\"DelegateVotesChanged(address,uint256,uint256)\":{\"notice\":\"An event thats emitted when a delegate account's vote balance changes\"},\"Transfer(address,address,uint256)\":{\"notice\":\"The standard EIP-20 transfer event\"}},\"kind\":\"user\",\"methods\":{\"DELEGATION_TYPEHASH()\":{\"notice\":\"The EIP-712 typehash for the delegation struct used by the contract\"},\"DOMAIN_TYPEHASH()\":{\"notice\":\"The EIP-712 typehash for the contract's domain\"},\"allowance(address,address)\":{\"notice\":\"Get the number of tokens `spender` is approved to spend on behalf of `account`\"},\"approve(address,uint256)\":{\"notice\":\"Approve `spender` to transfer up to `amount` from `src`\"},\"balanceOf(address)\":{\"notice\":\"Get the number of tokens held by the `account`\"},\"checkpoints(address,uint32)\":{\"notice\":\"A record of votes checkpoints for each account, by index\"},\"constructor\":\"Construct a new HST token\",\"decimals()\":{\"notice\":\"EIP-20 token decimals for this token\"},\"delegate(address)\":{\"notice\":\"Delegate votes from `msg.sender` to `delegatee`\"},\"delegateBySig(address,uint256,uint256,uint8,bytes32,bytes32)\":{\"notice\":\"Delegates votes from signatory to `delegatee`\"},\"delegates(address)\":{\"notice\":\"A record of each accounts delegate\"},\"getCurrentVotes(address)\":{\"notice\":\"Gets the current votes balance for `account`\"},\"getPriorVotes(address,uint256)\":{\"notice\":\"Determine the prior number of votes for an account as of a block number\"},\"name()\":{\"notice\":\"EIP-20 token name for this token\"},\"nonces(address)\":{\"notice\":\"A record of states for signing / validating signatures\"},\"numCheckpoints(address)\":{\"notice\":\"The number of checkpoints for each account\"},\"symbol()\":{\"notice\":\"EIP-20 token symbol for this token\"},\"totalSupply()\":{\"notice\":\"Total number of tokens in circulation\"},\"transfer(address,uint256)\":{\"notice\":\"Transfer `amount` tokens from `msg.sender` to `dst`\"},\"transferFrom(address,address,uint256)\":{\"notice\":\"Transfer `amount` tokens from `src` to `dst`\"}},\"version\":1}},\"settings\":{\"compilationTarget\":{\"contracts/XIS.sol\":\"XIS\"},\"evmVersion\":\"istanbul\",\"libraries\":{\"__CACHE_BREAKER__\":\"0x00000000d41867734bbee4c6863d9255b2b06ac1\"},\"metadata\":{\"bytecodeHash\":\"ipfs\",\"useLiteralContent\":true},\"optimizer\":{\"enabled\":true,\"runs\":200},\"remappings\":[]},\"sources\":{\"contracts/XIS.sol\":{\"content\":\"// SPDX-License-Identifier: MIT\\n\\n/**\\n *Submitted for verification at Etherscan.io on 2020-03-04\\n */\\n\\npragma solidity ^0.6.12;\\npragma experimental ABIEncoderV2;\\n\\ncontract XIS {\\n    /// @notice EIP-20 token name for this token\\n    string public constant name = \\\"iSWAP Token\\\";\\n\\n    /// @notice EIP-20 token symbol for this token\\n    string public constant symbol = \\\"XIS\\\";\\n\\n    /// @notice EIP-20 token decimals for this token\\n    uint8 public constant decimals = 18;\\n\\n    /// @notice Total number of tokens in circulation\\n    uint256 public constant totalSupply = 50e24; // 10 million XIS\\n\\n    mapping(address => mapping(address => uint96)) internal allowances;\\n\\n    mapping(address => uint96) internal balances;\\n\\n    /// @notice A record of each accounts delegate\\n    mapping(address => address) public delegates;\\n\\n    /// @notice A checkpoint for marking number of votes from a given block\\n    struct Checkpoint {\\n        uint32 fromBlock;\\n        uint96 votes;\\n    }\\n\\n    /// @notice A record of votes checkpoints for each account, by index\\n    mapping(address => mapping(uint32 => Checkpoint)) public checkpoints;\\n\\n    /// @notice The number of checkpoints for each account\\n    mapping(address => uint32) public numCheckpoints;\\n\\n    /// @notice The EIP-712 typehash for the contract's domain\\n    bytes32 public constant DOMAIN_TYPEHASH =\\n        keccak256(\\n            \\\"EIP712Domain(string name,uint256 chainId,address verifyingContract)\\\"\\n        );\\n\\n    /// @notice The EIP-712 typehash for the delegation struct used by the contract\\n    bytes32 public constant DELEGATION_TYPEHASH =\\n        keccak256(\\\"Delegation(address delegatee,uint256 nonce,uint256 expiry)\\\");\\n\\n    /// @notice A record of states for signing / validating signatures\\n    mapping(address => uint256) public nonces;\\n\\n    /// @notice An event thats emitted when an account changes its delegate\\n    event DelegateChanged(\\n        address indexed delegator,\\n        address indexed fromDelegate,\\n        address indexed toDelegate\\n    );\\n\\n    /// @notice An event thats emitted when a delegate account's vote balance changes\\n    event DelegateVotesChanged(\\n        address indexed delegate,\\n        uint256 previousBalance,\\n        uint256 newBalance\\n    );\\n\\n    /// @notice The standard EIP-20 transfer event\\n    event Transfer(address indexed from, address indexed to, uint256 amount);\\n\\n    /// @notice The standard EIP-20 approval event\\n    event Approval(\\n        address indexed owner,\\n        address indexed spender,\\n        uint256 amount\\n    );\\n\\n    /**\\n     * @notice Construct a new HST token\\n     */\\n    constructor() public {\\n        balances[msg.sender] = uint96(totalSupply);\\n        emit Transfer(address(0), msg.sender, totalSupply);\\n    }\\n\\n    /**\\n     * @notice Get the number of tokens `spender` is approved to spend on behalf of `account`\\n     * @param account The address of the account holding the funds\\n     * @param spender The address of the account spending the funds\\n     * @return The number of tokens approved\\n     */\\n    function allowance(address account, address spender)\\n        external\\n        view\\n        returns (uint256)\\n    {\\n        return allowances[account][spender];\\n    }\\n\\n    /**\\n     * @notice Approve `spender` to transfer up to `amount` from `src`\\n     * @dev This will overwrite the approval amount for `spender`\\n     *  and is subject to issues noted [here](https://eips.ethereum.org/EIPS/eip-20#approve)\\n     * @param spender The address of the account which may transfer tokens\\n     * @param rawAmount The number of tokens that are approved (2^256-1 means infinite)\\n     * @return Whether or not the approval succeeded\\n     */\\n    function approve(address spender, uint256 rawAmount)\\n        external\\n        returns (bool)\\n    {\\n        uint96 amount;\\n        if (rawAmount == uint256(-1)) {\\n            amount = uint96(-1);\\n        } else {\\n            amount = safe96(rawAmount, \\\"HST::approve: amount exceeds 96 bits\\\");\\n        }\\n\\n        allowances[msg.sender][spender] = amount;\\n\\n        emit Approval(msg.sender, spender, amount);\\n        return true;\\n    }\\n\\n    /**\\n     * @notice Get the number of tokens held by the `account`\\n     * @param account The address of the account to get the balance of\\n     * @return The number of tokens held\\n     */\\n    function balanceOf(address account) external view returns (uint256) {\\n        return balances[account];\\n    }\\n\\n    /**\\n     * @notice Transfer `amount` tokens from `msg.sender` to `dst`\\n     * @param dst The address of the destination account\\n     * @param rawAmount The number of tokens to transfer\\n     * @return Whether or not the transfer succeeded\\n     */\\n    function transfer(address dst, uint256 rawAmount) external returns (bool) {\\n        uint96 amount =\\n            safe96(rawAmount, \\\"HST::transfer: amount exceeds 96 bits\\\");\\n        _transferTokens(msg.sender, dst, amount);\\n        return true;\\n    }\\n\\n    /**\\n     * @notice Transfer `amount` tokens from `src` to `dst`\\n     * @param src The address of the source account\\n     * @param dst The address of the destination account\\n     * @param rawAmount The number of tokens to transfer\\n     * @return Whether or not the transfer succeeded\\n     */\\n    function transferFrom(\\n        address src,\\n        address dst,\\n        uint256 rawAmount\\n    ) external returns (bool) {\\n        address spender = msg.sender;\\n        uint96 spenderAllowance = allowances[src][spender];\\n        uint96 amount =\\n            safe96(rawAmount, \\\"HST::approve: amount exceeds 96 bits\\\");\\n\\n        if (spender != src && spenderAllowance != uint96(-1)) {\\n            uint96 newAllowance =\\n                sub96(\\n                    spenderAllowance,\\n                    amount,\\n                    \\\"HST::transferFrom: transfer amount exceeds spender allowance\\\"\\n                );\\n            allowances[src][spender] = newAllowance;\\n\\n            emit Approval(src, spender, newAllowance);\\n        }\\n\\n        _transferTokens(src, dst, amount);\\n        return true;\\n    }\\n\\n    /**\\n     * @notice Delegate votes from `msg.sender` to `delegatee`\\n     * @param delegatee The address to delegate votes to\\n     */\\n    function delegate(address delegatee) public {\\n        return _delegate(msg.sender, delegatee);\\n    }\\n\\n    /**\\n     * @notice Delegates votes from signatory to `delegatee`\\n     * @param delegatee The address to delegate votes to\\n     * @param nonce The contract state required to match the signature\\n     * @param expiry The time at which to expire the signature\\n     * @param v The recovery byte of the signature\\n     * @param r Half of the ECDSA signature pair\\n     * @param s Half of the ECDSA signature pair\\n     */\\n    function delegateBySig(\\n        address delegatee,\\n        uint256 nonce,\\n        uint256 expiry,\\n        uint8 v,\\n        bytes32 r,\\n        bytes32 s\\n    ) public {\\n        bytes32 domainSeparator =\\n            keccak256(\\n                abi.encode(\\n                    DOMAIN_TYPEHASH,\\n                    keccak256(bytes(name)),\\n                    getChainId(),\\n                    address(this)\\n                )\\n            );\\n        bytes32 structHash =\\n            keccak256(\\n                abi.encode(DELEGATION_TYPEHASH, delegatee, nonce, expiry)\\n            );\\n        bytes32 digest =\\n            keccak256(\\n                abi.encodePacked(\\\"\\\\x19\\\\x01\\\", domainSeparator, structHash)\\n            );\\n        address signatory = ecrecover(digest, v, r, s);\\n        require(\\n            signatory != address(0),\\n            \\\"HST::delegateBySig: invalid signature\\\"\\n        );\\n        require(\\n            nonce == nonces[signatory]++,\\n            \\\"HST::delegateBySig: invalid nonce\\\"\\n        );\\n        require(now <= expiry, \\\"HST::delegateBySig: signature expired\\\");\\n        return _delegate(signatory, delegatee);\\n    }\\n\\n    /**\\n     * @notice Gets the current votes balance for `account`\\n     * @param account The address to get votes balance\\n     * @return The number of current votes for `account`\\n     */\\n    function getCurrentVotes(address account) external view returns (uint96) {\\n        uint32 nCheckpoints = numCheckpoints[account];\\n        return\\n            nCheckpoints > 0 ? checkpoints[account][nCheckpoints - 1].votes : 0;\\n    }\\n\\n    /**\\n     * @notice Determine the prior number of votes for an account as of a block number\\n     * @dev Block number must be a finalized block or else this function will revert to prevent misinformation.\\n     * @param account The address of the account to check\\n     * @param blockNumber The block number to get the vote balance at\\n     * @return The number of votes the account had as of the given block\\n     */\\n    function getPriorVotes(address account, uint256 blockNumber)\\n        public\\n        view\\n        returns (uint96)\\n    {\\n        require(\\n            blockNumber < block.number,\\n            \\\"HST::getPriorVotes: not yet determined\\\"\\n        );\\n\\n        uint32 nCheckpoints = numCheckpoints[account];\\n        if (nCheckpoints == 0) {\\n            return 0;\\n        }\\n\\n        // First check most recent balance\\n        if (checkpoints[account][nCheckpoints - 1].fromBlock <= blockNumber) {\\n            return checkpoints[account][nCheckpoints - 1].votes;\\n        }\\n\\n        // Next check implicit zero balance\\n        if (checkpoints[account][0].fromBlock > blockNumber) {\\n            return 0;\\n        }\\n\\n        uint32 lower = 0;\\n        uint32 upper = nCheckpoints - 1;\\n        while (upper > lower) {\\n            uint32 center = upper - (upper - lower) / 2; // ceil, avoiding overflow\\n            Checkpoint memory cp = checkpoints[account][center];\\n            if (cp.fromBlock == blockNumber) {\\n                return cp.votes;\\n            } else if (cp.fromBlock < blockNumber) {\\n                lower = center;\\n            } else {\\n                upper = center - 1;\\n            }\\n        }\\n        return checkpoints[account][lower].votes;\\n    }\\n\\n    function _delegate(address delegator, address delegatee) internal {\\n        address currentDelegate = delegates[delegator];\\n        uint96 delegatorBalance = balances[delegator];\\n        delegates[delegator] = delegatee;\\n\\n        emit DelegateChanged(delegator, currentDelegate, delegatee);\\n\\n        _moveDelegates(currentDelegate, delegatee, delegatorBalance);\\n    }\\n\\n    function _transferTokens(\\n        address src,\\n        address dst,\\n        uint96 amount\\n    ) internal {\\n        require(\\n            src != address(0),\\n            \\\"HST::_transferTokens: cannot transfer from the zero address\\\"\\n        );\\n        require(\\n            dst != address(0),\\n            \\\"HST::_transferTokens: cannot transfer to the zero address\\\"\\n        );\\n\\n        balances[src] = sub96(\\n            balances[src],\\n            amount,\\n            \\\"HST::_transferTokens: transfer amount exceeds balance\\\"\\n        );\\n        balances[dst] = add96(\\n            balances[dst],\\n            amount,\\n            \\\"HST::_transferTokens: transfer amount overflows\\\"\\n        );\\n        emit Transfer(src, dst, amount);\\n\\n        _moveDelegates(delegates[src], delegates[dst], amount);\\n    }\\n\\n    function _moveDelegates(\\n        address srcRep,\\n        address dstRep,\\n        uint96 amount\\n    ) internal {\\n        if (srcRep != dstRep && amount > 0) {\\n            if (srcRep != address(0)) {\\n                uint32 srcRepNum = numCheckpoints[srcRep];\\n                uint96 srcRepOld =\\n                    srcRepNum > 0\\n                        ? checkpoints[srcRep][srcRepNum - 1].votes\\n                        : 0;\\n                uint96 srcRepNew =\\n                    sub96(\\n                        srcRepOld,\\n                        amount,\\n                        \\\"HST::_moveVotes: vote amount underflows\\\"\\n                    );\\n                _writeCheckpoint(srcRep, srcRepNum, srcRepOld, srcRepNew);\\n            }\\n\\n            if (dstRep != address(0)) {\\n                uint32 dstRepNum = numCheckpoints[dstRep];\\n                uint96 dstRepOld =\\n                    dstRepNum > 0\\n                        ? checkpoints[dstRep][dstRepNum - 1].votes\\n                        : 0;\\n                uint96 dstRepNew =\\n                    add96(\\n                        dstRepOld,\\n                        amount,\\n                        \\\"HST::_moveVotes: vote amount overflows\\\"\\n                    );\\n                _writeCheckpoint(dstRep, dstRepNum, dstRepOld, dstRepNew);\\n            }\\n        }\\n    }\\n\\n    function _writeCheckpoint(\\n        address delegatee,\\n        uint32 nCheckpoints,\\n        uint96 oldVotes,\\n        uint96 newVotes\\n    ) internal {\\n        uint32 blockNumber =\\n            safe32(\\n                block.number,\\n                \\\"HST::_writeCheckpoint: block number exceeds 32 bits\\\"\\n            );\\n\\n        if (\\n            nCheckpoints > 0 &&\\n            checkpoints[delegatee][nCheckpoints - 1].fromBlock == blockNumber\\n        ) {\\n            checkpoints[delegatee][nCheckpoints - 1].votes = newVotes;\\n        } else {\\n            checkpoints[delegatee][nCheckpoints] = Checkpoint(\\n                blockNumber,\\n                newVotes\\n            );\\n            numCheckpoints[delegatee] = nCheckpoints + 1;\\n        }\\n\\n        emit DelegateVotesChanged(delegatee, oldVotes, newVotes);\\n    }\\n\\n    function safe32(uint256 n, string memory errorMessage)\\n        internal\\n        pure\\n        returns (uint32)\\n    {\\n        require(n < 2**32, errorMessage);\\n        return uint32(n);\\n    }\\n\\n    function safe96(uint256 n, string memory errorMessage)\\n        internal\\n        pure\\n        returns (uint96)\\n    {\\n        require(n < 2**96, errorMessage);\\n        return uint96(n);\\n    }\\n\\n    function add96(\\n        uint96 a,\\n        uint96 b,\\n        string memory errorMessage\\n    ) internal pure returns (uint96) {\\n        uint96 c = a + b;\\n        require(c >= a, errorMessage);\\n        return c;\\n    }\\n\\n    function sub96(\\n        uint96 a,\\n        uint96 b,\\n        string memory errorMessage\\n    ) internal pure returns (uint96) {\\n        require(b <= a, errorMessage);\\n        return a - b;\\n    }\\n\\n    function getChainId() internal pure returns (uint256) {\\n        uint256 chainId;\\n        assembly {\\n            chainId := chainid()\\n        }\\n        return chainId;\\n    }\\n}\\n\",\"keccak256\":\"0xf79c816aab7c7aa25fdda8e48eea3f4c73948333648f14dcb2bad5242e1c1b5b\",\"license\":\"MIT\"}},\"version\":1}",
  "bytecode": "0x608060405234801561001057600080fd5b503360008181526001602052604080822080546001600160601b0319166a295be96e6406697200000090811790915590517fddf252ad1be2c89b69c2b068fc378daa952ba7f163c4a11628f55a4df523b3ef9161006c91610079565b60405180910390a3610082565b90815260200190565b6117c6806100916000396000f3fe608060405234801561001057600080fd5b50600436106101215760003560e01c806370a08231116100ad578063b4b5ea5711610071578063b4b5ea571461025f578063c3cda52014610272578063dd62ed3e14610285578063e7a324dc14610298578063f1127ed8146102a057610121565b806370a08231146101fe578063782d6fe1146102115780637ecebe001461023157806395d89b4114610244578063a9059cbb1461024c57610121565b806323b872dd116100f457806323b872dd14610181578063313ce56714610194578063587cde1e146101a95780635c19a95c146101c95780636fcfff45146101de57610121565b806306fdde0314610126578063095ea7b31461014457806318160ddd1461016457806320606b7014610179575b600080fd5b61012e6102c1565b60405161013b9190611388565b60405180910390f35b610157610152366004611217565b6102e8565b60405161013b919061130e565b61016c6103a5565b60405161013b9190611319565b61016c6103b4565b61015761018f3660046111d7565b6103d8565b61019c61051b565b60405161013b91906115d6565b6101bc6101b7366004611188565b610520565b60405161013b91906112fa565b6101dc6101d7366004611188565b61053b565b005b6101f16101ec366004611188565b610548565b60405161013b91906115a6565b61016c61020c366004611188565b610560565b61022461021f366004611217565b610584565b60405161013b91906115e4565b61016c61023f366004611188565b61079b565b61012e6107ad565b61015761025a366004611217565b6107cc565b61022461026d366004611188565b610808565b6101dc610280366004611241565b610879565b61016c6102933660046111a3565b610a82565b61016c610ab4565b6102b36102ae3660046112a0565b610ad8565b60405161013b9291906115b7565b6040518060400160405280600b81526020016a34a9aba0a8102a37b5b2b760a91b81525081565b6000806000198314156102fe5750600019610323565b610320836040518060600160405280602481526020016116fc60249139610b0d565b90505b336000818152602081815260408083206001600160a01b03891680855292529182902080546001600160601b0319166001600160601b03861617905590519091907f8c5be1e5ebec7d5bd14f71427d1e84f3dd0314c0f7b2291e5b200ac8c7c3b925906103919085906115e4565b60405180910390a360019150505b92915050565b6a295be96e6406697200000081565b7f8cad95687ba82c2ce50e74f7b754645e5117c3a5bec8151c0726d5857980a86681565b6001600160a01b0383166000908152602081815260408083203380855290835281842054825160608101909352602480845291936001600160601b0390911692859261042e92889291906116fc90830139610b0d565b9050866001600160a01b0316836001600160a01b03161415801561045b57506001600160601b0382811614155b1561050357600061048583836040518060600160405280603c8152602001611755603c9139610b3c565b6001600160a01b03898116600081815260208181526040808320948a16808452949091529081902080546001600160601b0319166001600160601b0386161790555192935090917f8c5be1e5ebec7d5bd14f71427d1e84f3dd0314c0f7b2291e5b200ac8c7c3b925906104f99085906115e4565b60405180910390a3505b61050e878783610b7b565b5060019695505050505050565b601281565b6002602052600090815260409020546001600160a01b031681565b6105453382610d26565b50565b60046020526000908152604090205463ffffffff1681565b6001600160a01b03166000908152600160205260409020546001600160601b031690565b60004382106105ae5760405162461bcd60e51b81526004016105a59061151b565b60405180910390fd5b6001600160a01b03831660009081526004602052604090205463ffffffff16806105dc57600091505061039f565b6001600160a01b038416600090815260036020908152604080832063ffffffff600019860181168552925290912054168310610658576001600160a01b03841660009081526003602090815260408083206000199490940163ffffffff1683529290522054600160201b90046001600160601b0316905061039f565b6001600160a01b038416600090815260036020908152604080832083805290915290205463ffffffff1683101561069357600091505061039f565b600060001982015b8163ffffffff168163ffffffff16111561075657600282820363ffffffff160481036106c561115a565b506001600160a01b038716600090815260036020908152604080832063ffffffff858116855290835292819020815180830190925254928316808252600160201b9093046001600160601b031691810191909152908714156107315760200151945061039f9350505050565b805163ffffffff168711156107485781935061074f565b6001820392505b505061069b565b506001600160a01b038516600090815260036020908152604080832063ffffffff909416835292905220546001600160601b03600160201b9091041691505092915050565b60056020526000908152604090205481565b6040518060400160405280600381526020016258495360e81b81525081565b6000806107f18360405180606001604052806025815260200161168260259139610b0d565b90506107fe338583610b7b565b5060019392505050565b6001600160a01b03811660009081526004602052604081205463ffffffff1680610833576000610872565b6001600160a01b0383166000908152600360209081526040808320600019850163ffffffff168452909152902054600160201b90046001600160601b03165b9392505050565b60408051808201909152600b81526a34a9aba0a8102a37b5b2b760a91b60209091015260007f8cad95687ba82c2ce50e74f7b754645e5117c3a5bec8151c0726d5857980a8667f057d3bde20e7297bbe3454c4d774e169ff6eab3fd16469bfcf3c59438d91c2d46108e8610db0565b306040516020016108fc9493929190611346565b60405160208183030381529060405280519060200120905060007fe48329057bfd03d55e49b547132e39cffd9c1820ad7b9d4c5307691425d15adf88888860405160200161094d9493929190611322565b6040516020818303038152906040528051906020012090506000828260405160200161097a9291906112df565b6040516020818303038152906040528051906020012090506000600182888888604051600081526020016040526040516109b7949392919061136a565b6020604051602081039080840390855afa1580156109d9573d6000803e3d6000fd5b5050604051601f1901519150506001600160a01b038116610a0c5760405162461bcd60e51b81526004016105a5906114d6565b6001600160a01b03811660009081526005602052604090208054600181019091558914610a4b5760405162461bcd60e51b81526004016105a590611495565b87421115610a6b5760405162461bcd60e51b81526004016105a590611561565b610a75818b610d26565b505050505b505050505050565b6001600160a01b039182166000908152602081815260408083209390941682529190915220546001600160601b031690565b7fe48329057bfd03d55e49b547132e39cffd9c1820ad7b9d4c5307691425d15adf81565b600360209081526000928352604080842090915290825290205463ffffffff811690600160201b90046001600160601b031682565b600081600160601b8410610b345760405162461bcd60e51b81526004016105a59190611388565b509192915050565b6000836001600160601b0316836001600160601b031611158290610b735760405162461bcd60e51b81526004016105a59190611388565b505050900390565b6001600160a01b038316610ba15760405162461bcd60e51b81526004016105a5906113db565b6001600160a01b038216610bc75760405162461bcd60e51b81526004016105a590611438565b6001600160a01b038316600090815260016020908152604091829020548251606081019093526035808452610c12936001600160601b03909216928592919061172090830139610b3c565b6001600160a01b03848116600090815260016020908152604080832080546001600160601b0319166001600160601b0396871617905592861682529082902054825160608101909352602f808452610c7a94919091169285929091906116cd90830139610db4565b6001600160a01b038381166000818152600160205260409081902080546001600160601b0319166001600160601b0395909516949094179093559151908516907fddf252ad1be2c89b69c2b068fc378daa952ba7f163c4a11628f55a4df523b3ef90610ce79085906115e4565b60405180910390a36001600160a01b03808416600090815260026020526040808220548584168352912054610d2192918216911683610df0565b505050565b6001600160a01b03808316600081815260026020818152604080842080546001845282862054949093528787166001600160a01b031984168117909155905191909516946001600160601b039092169391928592917f3134e8a2e6d97e929a7e54011ea5485d7d196dd5f0ba4d4ef95803e8e3fc257f9190a4610daa828483610df0565b50505050565b4690565b6000838301826001600160601b038087169083161015610de75760405162461bcd60e51b81526004016105a59190611388565b50949350505050565b816001600160a01b0316836001600160a01b031614158015610e1b57506000816001600160601b0316115b15610d21576001600160a01b03831615610ed3576001600160a01b03831660009081526004602052604081205463ffffffff169081610e5b576000610e9a565b6001600160a01b0385166000908152600360209081526040808320600019860163ffffffff168452909152902054600160201b90046001600160601b03165b90506000610ec1828560405180606001604052806027815260200161165b60279139610b3c565b9050610ecf86848484610f7e565b5050505b6001600160a01b03821615610d21576001600160a01b03821660009081526004602052604081205463ffffffff169081610f0e576000610f4d565b6001600160a01b0384166000908152600360209081526040808320600019860163ffffffff168452909152902054600160201b90046001600160601b03165b90506000610f7482856040518060600160405280602681526020016116a760269139610db4565b9050610a7a858484845b6000610fa24360405180606001604052806033815260200161162860339139611133565b905060008463ffffffff16118015610feb57506001600160a01b038516600090815260036020908152604080832063ffffffff6000198901811685529252909120548282169116145b1561104a576001600160a01b0385166000908152600360209081526040808320600019880163ffffffff168452909152902080546fffffffffffffffffffffffff000000001916600160201b6001600160601b038516021790556110e9565b60408051808201825263ffffffff80841682526001600160601b0380861660208085019182526001600160a01b038b166000818152600383528781208c871682528352878120965187549451909516600160201b026fffffffffffffffffffffffff000000001995871663ffffffff19958616179590951694909417909555938252600490935292909220805460018801909316929091169190911790555b846001600160a01b03167fdec2bacdd2f05b59de34da9b523dff8be42e5e38e818c82fdb0bae774387a72484846040516111249291906115f8565b60405180910390a25050505050565b600081600160201b8410610b345760405162461bcd60e51b81526004016105a59190611388565b604080518082019091526000808252602082015290565b80356001600160a01b038116811461039f57600080fd5b600060208284031215611199578081fd5b6108728383611171565b600080604083850312156111b5578081fd5b6111bf8484611171565b91506111ce8460208501611171565b90509250929050565b6000806000606084860312156111eb578081fd5b83356111f681611612565b9250602084013561120681611612565b929592945050506040919091013590565b60008060408385031215611229578182fd5b6112338484611171565b946020939093013593505050565b60008060008060008060c08789031215611259578182fd5b6112638888611171565b95506020870135945060408701359350606087013560ff81168114611286578283fd5b9598949750929560808101359460a0909101359350915050565b600080604083850312156112b2578182fd5b6112bc8484611171565b9150602083013563ffffffff811681146112d4578182fd5b809150509250929050565b61190160f01b81526002810192909252602282015260420190565b6001600160a01b0391909116815260200190565b901515815260200190565b90815260200190565b9384526001600160a01b039290921660208401526040830152606082015260800190565b938452602084019290925260408301526001600160a01b0316606082015260800190565b93845260ff9290921660208401526040830152606082015260800190565b6000602080835283518082850152825b818110156113b457858101830151858201604001528201611398565b818111156113c55783604083870101525b50601f01601f1916929092016040019392505050565b6020808252603b908201527f4853543a3a5f7472616e73666572546f6b656e733a2063616e6e6f742074726160408201527f6e736665722066726f6d20746865207a65726f20616464726573730000000000606082015260800190565b60208082526039908201527f4853543a3a5f7472616e73666572546f6b656e733a2063616e6e6f742074726160408201527f6e7366657220746f20746865207a65726f206164647265737300000000000000606082015260800190565b60208082526021908201527f4853543a3a64656c656761746542795369673a20696e76616c6964206e6f6e636040820152606560f81b606082015260800190565b60208082526025908201527f4853543a3a64656c656761746542795369673a20696e76616c6964207369676e604082015264617475726560d81b606082015260800190565b60208082526026908201527f4853543a3a6765745072696f72566f7465733a206e6f742079657420646574656040820152651c9b5a5b995960d21b606082015260800190565b60208082526025908201527f4853543a3a64656c656761746542795369673a207369676e61747572652065786040820152641c1a5c995960da1b606082015260800190565b63ffffffff91909116815260200190565b63ffffffff9290921682526001600160601b0316602082015260400190565b60ff91909116815260200190565b6001600160601b0391909116815260200190565b6001600160601b0392831681529116602082015260400190565b6001600160a01b038116811461054557600080fdfe4853543a3a5f7772697465436865636b706f696e743a20626c6f636b206e756d626572206578636565647320333220626974734853543a3a5f6d6f7665566f7465733a20766f746520616d6f756e7420756e646572666c6f77734853543a3a7472616e736665723a20616d6f756e74206578636565647320393620626974734853543a3a5f6d6f7665566f7465733a20766f746520616d6f756e74206f766572666c6f77734853543a3a5f7472616e73666572546f6b656e733a207472616e7366657220616d6f756e74206f766572666c6f77734853543a3a617070726f76653a20616d6f756e74206578636565647320393620626974734853543a3a5f7472616e73666572546f6b656e733a207472616e7366657220616d6f756e7420657863656564732062616c616e63654853543a3a7472616e7366657246726f6d3a207472616e7366657220616d6f756e742065786365656473207370656e64657220616c6c6f77616e6365a264697066735822122038dd787bc81359f65821771bce9031a67bd8bc329f64eb5efa78c1a9d7a7d76964736f6c634300060c0033",
  "deployedBytecode": "0x608060405234801561001057600080fd5b50600436106101215760003560e01c806370a08231116100ad578063b4b5ea5711610071578063b4b5ea571461025f578063c3cda52014610272578063dd62ed3e14610285578063e7a324dc14610298578063f1127ed8146102a057610121565b806370a08231146101fe578063782d6fe1146102115780637ecebe001461023157806395d89b4114610244578063a9059cbb1461024c57610121565b806323b872dd116100f457806323b872dd14610181578063313ce56714610194578063587cde1e146101a95780635c19a95c146101c95780636fcfff45146101de57610121565b806306fdde0314610126578063095ea7b31461014457806318160ddd1461016457806320606b7014610179575b600080fd5b61012e6102c1565b60405161013b9190611388565b60405180910390f35b610157610152366004611217565b6102e8565b60405161013b919061130e565b61016c6103a5565b60405161013b9190611319565b61016c6103b4565b61015761018f3660046111d7565b6103d8565b61019c61051b565b60405161013b91906115d6565b6101bc6101b7366004611188565b610520565b60405161013b91906112fa565b6101dc6101d7366004611188565b61053b565b005b6101f16101ec366004611188565b610548565b60405161013b91906115a6565b61016c61020c366004611188565b610560565b61022461021f366004611217565b610584565b60405161013b91906115e4565b61016c61023f366004611188565b61079b565b61012e6107ad565b61015761025a366004611217565b6107cc565b61022461026d366004611188565b610808565b6101dc610280366004611241565b610879565b61016c6102933660046111a3565b610a82565b61016c610ab4565b6102b36102ae3660046112a0565b610ad8565b60405161013b9291906115b7565b6040518060400160405280600b81526020016a34a9aba0a8102a37b5b2b760a91b81525081565b6000806000198314156102fe5750600019610323565b610320836040518060600160405280602481526020016116fc60249139610b0d565b90505b336000818152602081815260408083206001600160a01b03891680855292529182902080546001600160601b0319166001600160601b03861617905590519091907f8c5be1e5ebec7d5bd14f71427d1e84f3dd0314c0f7b2291e5b200ac8c7c3b925906103919085906115e4565b60405180910390a360019150505b92915050565b6a295be96e6406697200000081565b7f8cad95687ba82c2ce50e74f7b754645e5117c3a5bec8151c0726d5857980a86681565b6001600160a01b0383166000908152602081815260408083203380855290835281842054825160608101909352602480845291936001600160601b0390911692859261042e92889291906116fc90830139610b0d565b9050866001600160a01b0316836001600160a01b03161415801561045b57506001600160601b0382811614155b1561050357600061048583836040518060600160405280603c8152602001611755603c9139610b3c565b6001600160a01b03898116600081815260208181526040808320948a16808452949091529081902080546001600160601b0319166001600160601b0386161790555192935090917f8c5be1e5ebec7d5bd14f71427d1e84f3dd0314c0f7b2291e5b200ac8c7c3b925906104f99085906115e4565b60405180910390a3505b61050e878783610b7b565b5060019695505050505050565b601281565b6002602052600090815260409020546001600160a01b031681565b6105453382610d26565b50565b60046020526000908152604090205463ffffffff1681565b6001600160a01b03166000908152600160205260409020546001600160601b031690565b60004382106105ae5760405162461bcd60e51b81526004016105a59061151b565b60405180910390fd5b6001600160a01b03831660009081526004602052604090205463ffffffff16806105dc57600091505061039f565b6001600160a01b038416600090815260036020908152604080832063ffffffff600019860181168552925290912054168310610658576001600160a01b03841660009081526003602090815260408083206000199490940163ffffffff1683529290522054600160201b90046001600160601b0316905061039f565b6001600160a01b038416600090815260036020908152604080832083805290915290205463ffffffff1683101561069357600091505061039f565b600060001982015b8163ffffffff168163ffffffff16111561075657600282820363ffffffff160481036106c561115a565b506001600160a01b038716600090815260036020908152604080832063ffffffff858116855290835292819020815180830190925254928316808252600160201b9093046001600160601b031691810191909152908714156107315760200151945061039f9350505050565b805163ffffffff168711156107485781935061074f565b6001820392505b505061069b565b506001600160a01b038516600090815260036020908152604080832063ffffffff909416835292905220546001600160601b03600160201b9091041691505092915050565b60056020526000908152604090205481565b6040518060400160405280600381526020016258495360e81b81525081565b6000806107f18360405180606001604052806025815260200161168260259139610b0d565b90506107fe338583610b7b565b5060019392505050565b6001600160a01b03811660009081526004602052604081205463ffffffff1680610833576000610872565b6001600160a01b0383166000908152600360209081526040808320600019850163ffffffff168452909152902054600160201b90046001600160601b03165b9392505050565b60408051808201909152600b81526a34a9aba0a8102a37b5b2b760a91b60209091015260007f8cad95687ba82c2ce50e74f7b754645e5117c3a5bec8151c0726d5857980a8667f057d3bde20e7297bbe3454c4d774e169ff6eab3fd16469bfcf3c59438d91c2d46108e8610db0565b306040516020016108fc9493929190611346565b60405160208183030381529060405280519060200120905060007fe48329057bfd03d55e49b547132e39cffd9c1820ad7b9d4c5307691425d15adf88888860405160200161094d9493929190611322565b6040516020818303038152906040528051906020012090506000828260405160200161097a9291906112df565b6040516020818303038152906040528051906020012090506000600182888888604051600081526020016040526040516109b7949392919061136a565b6020604051602081039080840390855afa1580156109d9573d6000803e3d6000fd5b5050604051601f1901519150506001600160a01b038116610a0c5760405162461bcd60e51b81526004016105a5906114d6565b6001600160a01b03811660009081526005602052604090208054600181019091558914610a4b5760405162461bcd60e51b81526004016105a590611495565b87421115610a6b5760405162461bcd60e51b81526004016105a590611561565b610a75818b610d26565b505050505b505050505050565b6001600160a01b039182166000908152602081815260408083209390941682529190915220546001600160601b031690565b7fe48329057bfd03d55e49b547132e39cffd9c1820ad7b9d4c5307691425d15adf81565b600360209081526000928352604080842090915290825290205463ffffffff811690600160201b90046001600160601b031682565b600081600160601b8410610b345760405162461bcd60e51b81526004016105a59190611388565b509192915050565b6000836001600160601b0316836001600160601b031611158290610b735760405162461bcd60e51b81526004016105a59190611388565b505050900390565b6001600160a01b038316610ba15760405162461bcd60e51b81526004016105a5906113db565b6001600160a01b038216610bc75760405162461bcd60e51b81526004016105a590611438565b6001600160a01b038316600090815260016020908152604091829020548251606081019093526035808452610c12936001600160601b03909216928592919061172090830139610b3c565b6001600160a01b03848116600090815260016020908152604080832080546001600160601b0319166001600160601b0396871617905592861682529082902054825160608101909352602f808452610c7a94919091169285929091906116cd90830139610db4565b6001600160a01b038381166000818152600160205260409081902080546001600160601b0319166001600160601b0395909516949094179093559151908516907fddf252ad1be2c89b69c2b068fc378daa952ba7f163c4a11628f55a4df523b3ef90610ce79085906115e4565b60405180910390a36001600160a01b03808416600090815260026020526040808220548584168352912054610d2192918216911683610df0565b505050565b6001600160a01b03808316600081815260026020818152604080842080546001845282862054949093528787166001600160a01b031984168117909155905191909516946001600160601b039092169391928592917f3134e8a2e6d97e929a7e54011ea5485d7d196dd5f0ba4d4ef95803e8e3fc257f9190a4610daa828483610df0565b50505050565b4690565b6000838301826001600160601b038087169083161015610de75760405162461bcd60e51b81526004016105a59190611388565b50949350505050565b816001600160a01b0316836001600160a01b031614158015610e1b57506000816001600160601b0316115b15610d21576001600160a01b03831615610ed3576001600160a01b03831660009081526004602052604081205463ffffffff169081610e5b576000610e9a565b6001600160a01b0385166000908152600360209081526040808320600019860163ffffffff168452909152902054600160201b90046001600160601b03165b90506000610ec1828560405180606001604052806027815260200161165b60279139610b3c565b9050610ecf86848484610f7e565b5050505b6001600160a01b03821615610d21576001600160a01b03821660009081526004602052604081205463ffffffff169081610f0e576000610f4d565b6001600160a01b0384166000908152600360209081526040808320600019860163ffffffff168452909152902054600160201b90046001600160601b03165b90506000610f7482856040518060600160405280602681526020016116a760269139610db4565b9050610a7a858484845b6000610fa24360405180606001604052806033815260200161162860339139611133565b905060008463ffffffff16118015610feb57506001600160a01b038516600090815260036020908152604080832063ffffffff6000198901811685529252909120548282169116145b1561104a576001600160a01b0385166000908152600360209081526040808320600019880163ffffffff168452909152902080546fffffffffffffffffffffffff000000001916600160201b6001600160601b038516021790556110e9565b60408051808201825263ffffffff80841682526001600160601b0380861660208085019182526001600160a01b038b166000818152600383528781208c871682528352878120965187549451909516600160201b026fffffffffffffffffffffffff000000001995871663ffffffff19958616179590951694909417909555938252600490935292909220805460018801909316929091169190911790555b846001600160a01b03167fdec2bacdd2f05b59de34da9b523dff8be42e5e38e818c82fdb0bae774387a72484846040516111249291906115f8565b60405180910390a25050505050565b600081600160201b8410610b345760405162461bcd60e51b81526004016105a59190611388565b604080518082019091526000808252602082015290565b80356001600160a01b038116811461039f57600080fd5b600060208284031215611199578081fd5b6108728383611171565b600080604083850312156111b5578081fd5b6111bf8484611171565b91506111ce8460208501611171565b90509250929050565b6000806000606084860312156111eb578081fd5b83356111f681611612565b9250602084013561120681611612565b929592945050506040919091013590565b60008060408385031215611229578182fd5b6112338484611171565b946020939093013593505050565b60008060008060008060c08789031215611259578182fd5b6112638888611171565b95506020870135945060408701359350606087013560ff81168114611286578283fd5b9598949750929560808101359460a0909101359350915050565b600080604083850312156112b2578182fd5b6112bc8484611171565b9150602083013563ffffffff811681146112d4578182fd5b809150509250929050565b61190160f01b81526002810192909252602282015260420190565b6001600160a01b0391909116815260200190565b901515815260200190565b90815260200190565b9384526001600160a01b039290921660208401526040830152606082015260800190565b938452602084019290925260408301526001600160a01b0316606082015260800190565b93845260ff9290921660208401526040830152606082015260800190565b6000602080835283518082850152825b818110156113b457858101830151858201604001528201611398565b818111156113c55783604083870101525b50601f01601f1916929092016040019392505050565b6020808252603b908201527f4853543a3a5f7472616e73666572546f6b656e733a2063616e6e6f742074726160408201527f6e736665722066726f6d20746865207a65726f20616464726573730000000000606082015260800190565b60208082526039908201527f4853543a3a5f7472616e73666572546f6b656e733a2063616e6e6f742074726160408201527f6e7366657220746f20746865207a65726f206164647265737300000000000000606082015260800190565b60208082526021908201527f4853543a3a64656c656761746542795369673a20696e76616c6964206e6f6e636040820152606560f81b606082015260800190565b60208082526025908201527f4853543a3a64656c656761746542795369673a20696e76616c6964207369676e604082015264617475726560d81b606082015260800190565b60208082526026908201527f4853543a3a6765745072696f72566f7465733a206e6f742079657420646574656040820152651c9b5a5b995960d21b606082015260800190565b60208082526025908201527f4853543a3a64656c656761746542795369673a207369676e61747572652065786040820152641c1a5c995960da1b606082015260800190565b63ffffffff91909116815260200190565b63ffffffff9290921682526001600160601b0316602082015260400190565b60ff91909116815260200190565b6001600160601b0391909116815260200190565b6001600160601b0392831681529116602082015260400190565b6001600160a01b038116811461054557600080fdfe4853543a3a5f7772697465436865636b706f696e743a20626c6f636b206e756d626572206578636565647320333220626974734853543a3a5f6d6f7665566f7465733a20766f746520616d6f756e7420756e646572666c6f77734853543a3a7472616e736665723a20616d6f756e74206578636565647320393620626974734853543a3a5f6d6f7665566f7465733a20766f746520616d6f756e74206f766572666c6f77734853543a3a5f7472616e73666572546f6b656e733a207472616e7366657220616d6f756e74206f766572666c6f77734853543a3a617070726f76653a20616d6f756e74206578636565647320393620626974734853543a3a5f7472616e73666572546f6b656e733a207472616e7366657220616d6f756e7420657863656564732062616c616e63654853543a3a7472616e7366657246726f6d3a207472616e7366657220616d6f756e742065786365656473207370656e64657220616c6c6f77616e6365a264697066735822122038dd787bc81359f65821771bce9031a67bd8bc329f64eb5efa78c1a9d7a7d76964736f6c634300060c0033",
  "devdoc": {
    "kind": "dev",
    "methods": {
      "allowance(address,address)": {
        "params": {
          "account": "The address of the account holding the funds",
          "spender": "The address of the account spending the funds"
        },
        "returns": {
          "_0": "The number of tokens approved"
        }
      },
      "approve(address,uint256)": {
        "details": "This will overwrite the approval amount for `spender`  and is subject to issues noted [here](https://eips.ethereum.org/EIPS/eip-20#approve)",
        "params": {
          "rawAmount": "The number of tokens that are approved (2^256-1 means infinite)",
          "spender": "The address of the account which may transfer tokens"
        },
        "returns": {
          "_0": "Whether or not the approval succeeded"
        }
      },
      "balanceOf(address)": {
        "params": {
          "account": "The address of the account to get the balance of"
        },
        "returns": {
          "_0": "The number of tokens held"
        }
      },
      "delegate(address)": {
        "params": {
          "delegatee": "The address to delegate votes to"
        }
      },
      "delegateBySig(address,uint256,uint256,uint8,bytes32,bytes32)": {
        "params": {
          "delegatee": "The address to delegate votes to",
          "expiry": "The time at which to expire the signature",
          "nonce": "The contract state required to match the signature",
          "r": "Half of the ECDSA signature pair",
          "s": "Half of the ECDSA signature pair",
          "v": "The recovery byte of the signature"
        }
      },
      "getCurrentVotes(address)": {
        "params": {
          "account": "The address to get votes balance"
        },
        "returns": {
          "_0": "The number of current votes for `account`"
        }
      },
      "getPriorVotes(address,uint256)": {
        "details": "Block number must be a finalized block or else this function will revert to prevent misinformation.",
        "params": {
          "account": "The address of the account to check",
          "blockNumber": "The block number to get the vote balance at"
        },
        "returns": {
          "_0": "The number of votes the account had as of the given block"
        }
      },
      "transfer(address,uint256)": {
        "params": {
          "dst": "The address of the destination account",
          "rawAmount": "The number of tokens to transfer"
        },
        "returns": {
          "_0": "Whether or not the transfer succeeded"
        }
      },
      "transferFrom(address,address,uint256)": {
        "params": {
          "dst": "The address of the destination account",
          "rawAmount": "The number of tokens to transfer",
          "src": "The address of the source account"
        },
        "returns": {
          "_0": "Whether or not the transfer succeeded"
        }
      }
    },
    "version": 1
  },
  "userdoc": {
    "events": {
      "Approval(address,address,uint256)": {
        "notice": "The standard EIP-20 approval event"
      },
      "DelegateChanged(address,address,address)": {
        "notice": "An event thats emitted when an account changes its delegate"
      },
      "DelegateVotesChanged(address,uint256,uint256)": {
        "notice": "An event thats emitted when a delegate account's vote balance changes"
      },
      "Transfer(address,address,uint256)": {
        "notice": "The standard EIP-20 transfer event"
      }
    },
    "kind": "user",
    "methods": {
      "DELEGATION_TYPEHASH()": {
        "notice": "The EIP-712 typehash for the delegation struct used by the contract"
      },
      "DOMAIN_TYPEHASH()": {
        "notice": "The EIP-712 typehash for the contract's domain"
      },
      "allowance(address,address)": {
        "notice": "Get the number of tokens `spender` is approved to spend on behalf of `account`"
      },
      "approve(address,uint256)": {
        "notice": "Approve `spender` to transfer up to `amount` from `src`"
      },
      "balanceOf(address)": {
        "notice": "Get the number of tokens held by the `account`"
      },
      "checkpoints(address,uint32)": {
        "notice": "A record of votes checkpoints for each account, by index"
      },
      "constructor": "Construct a new HST token",
      "decimals()": {
        "notice": "EIP-20 token decimals for this token"
      },
      "delegate(address)": {
        "notice": "Delegate votes from `msg.sender` to `delegatee`"
      },
      "delegateBySig(address,uint256,uint256,uint8,bytes32,bytes32)": {
        "notice": "Delegates votes from signatory to `delegatee`"
      },
      "delegates(address)": {
        "notice": "A record of each accounts delegate"
      },
      "getCurrentVotes(address)": {
        "notice": "Gets the current votes balance for `account`"
      },
      "getPriorVotes(address,uint256)": {
        "notice": "Determine the prior number of votes for an account as of a block number"
      },
      "name()": {
        "notice": "EIP-20 token name for this token"
      },
      "nonces(address)": {
        "notice": "A record of states for signing / validating signatures"
      },
      "numCheckpoints(address)": {
        "notice": "The number of checkpoints for each account"
      },
      "symbol()": {
        "notice": "EIP-20 token symbol for this token"
      },
      "totalSupply()": {
        "notice": "Total number of tokens in circulation"
      },
      "transfer(address,uint256)": {
        "notice": "Transfer `amount` tokens from `msg.sender` to `dst`"
      },
      "transferFrom(address,address,uint256)": {
        "notice": "Transfer `amount` tokens from `src` to `dst`"
      }
    },
    "version": 1
  },
  "storageLayout": {
    "storage": [
      {
        "astId": 24,
        "contract": "contracts/XIS.sol:XIS",
        "label": "allowances",
        "offset": 0,
        "slot": "0",
        "type": "t_mapping(t_address,t_mapping(t_address,t_uint96))"
      },
      {
        "astId": 28,
        "contract": "contracts/XIS.sol:XIS",
        "label": "balances",
        "offset": 0,
        "slot": "1",
        "type": "t_mapping(t_address,t_uint96)"
      },
      {
        "astId": 33,
        "contract": "contracts/XIS.sol:XIS",
        "label": "delegates",
        "offset": 0,
        "slot": "2",
        "type": "t_mapping(t_address,t_address)"
      },
      {
        "astId": 45,
        "contract": "contracts/XIS.sol:XIS",
        "label": "checkpoints",
        "offset": 0,
        "slot": "3",
        "type": "t_mapping(t_address,t_mapping(t_uint32,t_struct(Checkpoint)38_storage))"
      },
      {
        "astId": 50,
        "contract": "contracts/XIS.sol:XIS",
        "label": "numCheckpoints",
        "offset": 0,
        "slot": "4",
        "type": "t_mapping(t_address,t_uint32)"
      },
      {
        "astId": 67,
        "contract": "contracts/XIS.sol:XIS",
        "label": "nonces",
        "offset": 0,
        "slot": "5",
        "type": "t_mapping(t_address,t_uint256)"
      }
    ],
    "types": {
      "t_address": {
        "encoding": "inplace",
        "label": "address",
        "numberOfBytes": "20"
      },
      "t_mapping(t_address,t_address)": {
        "encoding": "mapping",
        "key": "t_address",
        "label": "mapping(address => address)",
        "numberOfBytes": "32",
        "value": "t_address"
      },
      "t_mapping(t_address,t_mapping(t_address,t_uint96))": {
        "encoding": "mapping",
        "key": "t_address",
        "label": "mapping(address => mapping(address => uint96))",
        "numberOfBytes": "32",
        "value": "t_mapping(t_address,t_uint96)"
      },
      "t_mapping(t_address,t_mapping(t_uint32,t_struct(Checkpoint)38_storage))": {
        "encoding": "mapping",
        "key": "t_address",
        "label": "mapping(address => mapping(uint32 => struct XIS.Checkpoint))",
        "numberOfBytes": "32",
        "value": "t_mapping(t_uint32,t_struct(Checkpoint)38_storage)"
      },
      "t_mapping(t_address,t_uint256)": {
        "encoding": "mapping",
        "key": "t_address",
        "label": "mapping(address => uint256)",
        "numberOfBytes": "32",
        "value": "t_uint256"
      },
      "t_mapping(t_address,t_uint32)": {
        "encoding": "mapping",
        "key": "t_address",
        "label": "mapping(address => uint32)",
        "numberOfBytes": "32",
        "value": "t_uint32"
      },
      "t_mapping(t_address,t_uint96)": {
        "encoding": "mapping",
        "key": "t_address",
        "label": "mapping(address => uint96)",
        "numberOfBytes": "32",
        "value": "t_uint96"
      },
      "t_mapping(t_uint32,t_struct(Checkpoint)38_storage)": {
        "encoding": "mapping",
        "key": "t_uint32",
        "label": "mapping(uint32 => struct XIS.Checkpoint)",
        "numberOfBytes": "32",
        "value": "t_struct(Checkpoint)38_storage"
      },
      "t_struct(Checkpoint)38_storage": {
        "encoding": "inplace",
        "label": "struct XIS.Checkpoint",
        "members": [
          {
            "astId": 35,
            "contract": "contracts/XIS.sol:XIS",
            "label": "fromBlock",
            "offset": 0,
            "slot": "0",
            "type": "t_uint32"
          },
          {
            "astId": 37,
            "contract": "contracts/XIS.sol:XIS",
            "label": "votes",
            "offset": 4,
            "slot": "0",
            "type": "t_uint96"
          }
        ],
        "numberOfBytes": "32"
      },
      "t_uint256": {
        "encoding": "inplace",
        "label": "uint256",
        "numberOfBytes": "32"
      },
      "t_uint32": {
        "encoding": "inplace",
        "label": "uint32",
        "numberOfBytes": "4"
      },
      "t_uint96": {
        "encoding": "inplace",
        "label": "uint96",
        "numberOfBytes": "12"
      }
    }
  }
}